MCQ,Choices,Correct
What is the scientific study of life called?,a: Chemistry | b: Biology | c: Physics | d: Geology,b
Which theme in biology explains the unity and diversity of life?,a: Evolution | b: Photosynthesis | c: Mitosis | d: Respiration,a
What is the basic unit of life that all organisms are made up of?,a: Atoms | b: Molecules | c: Cells | d: Tissues,c
"What process allows organisms to move, grow, and reproduce?",a: Photosynthesis | b: Digestion | c: Energy processing | d: Respiration,c
What is the approximate age of life on Earth?,a: 500 million years | b: 1 billion years | c: 3.7 billion years | d: 5 billion years,c
